timestamp	commit	experiment_tag	num_envs	minibatch_size	mini_epochs	learning_rate	expl_block_size	time_to_target_s	status	description
2026-05-13T00:12:23-04:00	2fe0c76	baseline	512	2048	4	1e-4	128	3179.3	keep	measured baseline on this hardware
2026-05-13T01:03:43-04:00	d493cfc	lpeg_v_n512_mb2048_me4_lr3e-4	512	2048	4	3e-4	128	1841.0	keep	LR 1e-4 -> 3e-4; 42% faster than baseline
2026-05-13T01:03:43-04:00	449114c	lpeg_v_n512_mb2048_me8_lr1e-4	512	2048	8	1e-4	128	1754.9	keep	MINI_EPOCHS 4 -> 8; 45% faster than baseline; new best
2026-05-13T01:35:40-04:00	2cc4f39	lpeg_v_n512_mb2048_me8_lr3e-4	512	2048	8	3e-4	128	1557.5	keep	combine me8 + lr3e-4; 51% faster than baseline; new best
2026-05-13T01:57:50-04:00	a7e766c	lpeg_v_n512_mb2048_me16_lr1e-4	512	2048	16	1e-4	128	2491.1	discard	me=16 slower than me=8; mini_epochs has saturated
2026-05-13T02:24:38-04:00	7a1493c	lpeg_v_n512_mb2048_me8_lr1e-3	512	2048	8	1e-3	128	0	discard	LR=1e-3 oscillating, vmax 1.48 stalled at +2744s; LR too high
2026-05-13T02:24:38-04:00	877b77e	lpeg_v_n256_mb1024_me8_lr3e-4	256	1024	8	3e-4	64	1409.8	keep	NUM_ENVS halved to 256; 56% faster than baseline; new best
2026-05-13T02:51:35-04:00	b6ed60b	lpeg_v_n128_mb512_me8_lr3e-4	128	512	8	3e-4	32	1068.9	keep	NUM_ENVS=128; 66% faster than baseline; new best
2026-05-13T02:51:35-04:00	86b2d35	lpeg_v_n256_mb1024_me8_lr5e-4	256	1024	8	5e-4	64	1415.0	discard	LR=5e-4 at n256: 1415s, slightly slower than n256+lr3e-4 (1409.8s)
